{
  "schema": 1,
  "id": "toolrouter",
  "version": "0.1.0",
  "name": "toolrouter",
  "actions": [
    {
      "id": "ingest",
      "run": ["toolrouter", "ingest", "--no-save", "--json"],
      "output_schema": {
        "type": "object",
        "required": ["shell_read_tokens", "saved_tokens"],
        "properties": {
          "shell_read_tokens": { "type": "integer" },
          "saved_tokens": { "type": "integer" }
        }
      }
    }
  ]
}
